{
 "schema": "kingmaker.brain-library/1",
 "repo": "ronininc/kingmaker-brain-library",
 "updatedAt": "2026-10-16T07:35:02.265Z",
 "source": "ronininc/Kingmaker sol-ghost 989be97",
 "devices": [
  {
   "id": "m1-8gb",
   "chip": "M1",
   "ramGb": 8,
   "bandwidthGBs": 68,
   "macs": "MacBook Air, MacBook Pro 13/14, Mac mini, iMac",
   "class": 8,
   "pack": "8"
  },
  {
   "id": "m1-16gb",
   "chip": "M1",
   "ramGb": 16,
   "bandwidthGBs": 68,
   "macs": "MacBook Air, MacBook Pro 13/14, Mac mini, iMac",
   "class": 16,
   "pack": "16"
  },
  {
   "id": "m1-pro-16gb",
   "chip": "M1 Pro",
   "ramGb": 16,
   "bandwidthGBs": 200,
   "macs": "MacBook Pro 14/16, Mac mini",
   "class": 16,
   "pack": "16"
  },
  {
   "id": "m1-pro-32gb",
   "chip": "M1 Pro",
   "ramGb": 32,
   "bandwidthGBs": 200,
   "macs": "MacBook Pro 14/16, Mac mini",
   "class": 32,
   "pack": "32"
  },
  {
   "id": "m1-max-32gb",
   "chip": "M1 Max",
   "ramGb": 32,
   "bandwidthGBs": 400,
   "macs": "MacBook Pro 14/16, Mac Studio",
   "class": 32,
   "pack": "32"
  },
  {
   "id": "m1-max-64gb",
   "chip": "M1 Max",
   "ramGb": 64,
   "bandwidthGBs": 400,
   "macs": "MacBook Pro 14/16, Mac Studio",
   "class": 64,
   "pack": "64"
  },
  {
   "id": "m1-ultra-64gb",
   "chip": "M1 Ultra",
   "ramGb": 64,
   "bandwidthGBs": 800,
   "macs": "Mac Studio, Mac Pro",
   "class": 64,
   "pack": "64"
  },
  {
   "id": "m1-ultra-128gb",
   "chip": "M1 Ultra",
   "ramGb": 128,
   "bandwidthGBs": 800,
   "macs": "Mac Studio, Mac Pro",
   "class": 64,
   "pack": "64"
  },
  {
   "id": "m2-8gb",
   "chip": "M2",
   "ramGb": 8,
   "bandwidthGBs": 100,
   "macs": "MacBook Air, MacBook Pro 13/14, Mac mini, iMac",
   "class": 8,
   "pack": "8"
  },
  {
   "id": "m2-16gb",
   "chip": "M2",
   "ramGb": 16,
   "bandwidthGBs": 100,
   "macs": "MacBook Air, MacBook Pro 13/14, Mac mini, iMac",
   "class": 16,
   "pack": "16"
  },
  {
   "id": "m2-24gb",
   "chip": "M2",
   "ramGb": 24,
   "bandwidthGBs": 100,
   "macs": "MacBook Air, MacBook Pro 13/14, Mac mini, iMac",
   "class": 24,
   "pack": "24"
  },
  {
   "id": "m2-pro-16gb",
   "chip": "M2 Pro",
   "ramGb": 16,
   "bandwidthGBs": 200,
   "macs": "MacBook Pro 14/16, Mac mini",
   "class": 16,
   "pack": "16"
  },
  {
   "id": "m2-pro-32gb",
   "chip": "M2 Pro",
   "ramGb": 32,
   "bandwidthGBs": 200,
   "macs": "MacBook Pro 14/16, Mac mini",
   "class": 32,
   "pack": "32"
  },
  {
   "id": "m2-max-32gb",
   "chip": "M2 Max",
   "ramGb": 32,
   "bandwidthGBs": 400,
   "macs": "MacBook Pro 14/16, Mac Studio",
   "class": 32,
   "pack": "32"
  },
  {
   "id": "m2-max-64gb",
   "chip": "M2 Max",
   "ramGb": 64,
   "bandwidthGBs": 400,
   "macs": "MacBook Pro 14/16, Mac Studio",
   "class": 64,
   "pack": "64"
  },
  {
   "id": "m2-max-96gb",
   "chip": "M2 Max",
   "ramGb": 96,
   "bandwidthGBs": 400,
   "macs": "MacBook Pro 14/16, Mac Studio",
   "class": 64,
   "pack": "64"
  },
  {
   "id": "m2-ultra-64gb",
   "chip": "M2 Ultra",
   "ramGb": 64,
   "bandwidthGBs": 800,
   "macs": "Mac Studio, Mac Pro",
   "class": 64,
   "pack": "64"
  },
  {
   "id": "m2-ultra-128gb",
   "chip": "M2 Ultra",
   "ramGb": 128,
   "bandwidthGBs": 800,
   "macs": "Mac Studio, Mac Pro",
   "class": 64,
   "pack": "64"
  },
  {
   "id": "m2-ultra-192gb",
   "chip": "M2 Ultra",
   "ramGb": 192,
   "bandwidthGBs": 800,
   "macs": "Mac Studio, Mac Pro",
   "class": 64,
   "pack": "64"
  },
  {
   "id": "m3-8gb",
   "chip": "M3",
   "ramGb": 8,
   "bandwidthGBs": 100,
   "macs": "MacBook Air, MacBook Pro 13/14, Mac mini, iMac",
   "class": 8,
   "pack": "8"
  },
  {
   "id": "m3-16gb",
   "chip": "M3",
   "ramGb": 16,
   "bandwidthGBs": 100,
   "macs": "MacBook Air, MacBook Pro 13/14, Mac mini, iMac",
   "class": 16,
   "pack": "16"
  },
  {
   "id": "m3-24gb",
   "chip": "M3",
   "ramGb": 24,
   "bandwidthGBs": 100,
   "macs": "MacBook Air, MacBook Pro 13/14, Mac mini, iMac",
   "class": 24,
   "pack": "24"
  },
  {
   "id": "m3-pro-18gb",
   "chip": "M3 Pro",
   "ramGb": 18,
   "bandwidthGBs": 150,
   "macs": "MacBook Pro 14/16, Mac mini",
   "class": 16,
   "pack": "16"
  },
  {
   "id": "m3-pro-36gb",
   "chip": "M3 Pro",
   "ramGb": 36,
   "bandwidthGBs": 150,
   "macs": "MacBook Pro 14/16, Mac mini",
   "class": 32,
   "pack": "32"
  },
  {
   "id": "m3-max-36gb",
   "chip": "M3 Max",
   "ramGb": 36,
   "bandwidthGBs": 400,
   "macs": "MacBook Pro 14/16, Mac Studio",
   "class": 32,
   "pack": "32"
  },
  {
   "id": "m3-max-48gb",
   "chip": "M3 Max",
   "ramGb": 48,
   "bandwidthGBs": 400,
   "macs": "MacBook Pro 14/16, Mac Studio",
   "class": 48,
   "pack": "48"
  },
  {
   "id": "m3-max-64gb",
   "chip": "M3 Max",
   "ramGb": 64,
   "bandwidthGBs": 400,
   "macs": "MacBook Pro 14/16, Mac Studio",
   "class": 64,
   "pack": "64"
  },
  {
   "id": "m3-max-96gb",
   "chip": "M3 Max",
   "ramGb": 96,
   "bandwidthGBs": 400,
   "macs": "MacBook Pro 14/16, Mac Studio",
   "class": 64,
   "pack": "64"
  },
  {
   "id": "m3-max-128gb",
   "chip": "M3 Max",
   "ramGb": 128,
   "bandwidthGBs": 400,
   "macs": "MacBook Pro 14/16, Mac Studio",
   "class": 64,
   "pack": "64"
  },
  {
   "id": "m3-ultra-96gb",
   "chip": "M3 Ultra",
   "ramGb": 96,
   "bandwidthGBs": 819,
   "macs": "Mac Studio, Mac Pro",
   "class": 64,
   "pack": "64"
  },
  {
   "id": "m3-ultra-256gb",
   "chip": "M3 Ultra",
   "ramGb": 256,
   "bandwidthGBs": 819,
   "macs": "Mac Studio, Mac Pro",
   "class": 64,
   "pack": "64"
  },
  {
   "id": "m3-ultra-512gb",
   "chip": "M3 Ultra",
   "ramGb": 512,
   "bandwidthGBs": 819,
   "macs": "Mac Studio, Mac Pro",
   "class": 64,
   "pack": "64"
  },
  {
   "id": "m4-16gb",
   "chip": "M4",
   "ramGb": 16,
   "bandwidthGBs": 120,
   "macs": "MacBook Air, MacBook Pro 13/14, Mac mini, iMac",
   "class": 16,
   "pack": "16"
  },
  {
   "id": "m4-24gb",
   "chip": "M4",
   "ramGb": 24,
   "bandwidthGBs": 120,
   "macs": "MacBook Air, MacBook Pro 13/14, Mac mini, iMac",
   "class": 24,
   "pack": "24"
  },
  {
   "id": "m4-32gb",
   "chip": "M4",
   "ramGb": 32,
   "bandwidthGBs": 120,
   "macs": "MacBook Air, MacBook Pro 13/14, Mac mini, iMac",
   "class": 32,
   "pack": "32"
  },
  {
   "id": "m4-pro-24gb",
   "chip": "M4 Pro",
   "ramGb": 24,
   "bandwidthGBs": 273,
   "macs": "MacBook Pro 14/16, Mac mini",
   "class": 24,
   "pack": "24"
  },
  {
   "id": "m4-pro-48gb",
   "chip": "M4 Pro",
   "ramGb": 48,
   "bandwidthGBs": 273,
   "macs": "MacBook Pro 14/16, Mac mini",
   "class": 48,
   "pack": "48"
  },
  {
   "id": "m4-pro-64gb",
   "chip": "M4 Pro",
   "ramGb": 64,
   "bandwidthGBs": 273,
   "macs": "MacBook Pro 14/16, Mac mini",
   "class": 64,
   "pack": "64"
  },
  {
   "id": "m4-max-36gb",
   "chip": "M4 Max",
   "ramGb": 36,
   "bandwidthGBs": 546,
   "macs": "MacBook Pro 14/16, Mac Studio",
   "class": 32,
   "pack": "32"
  },
  {
   "id": "m4-max-48gb",
   "chip": "M4 Max",
   "ramGb": 48,
   "bandwidthGBs": 546,
   "macs": "MacBook Pro 14/16, Mac Studio",
   "class": 48,
   "pack": "48"
  },
  {
   "id": "m4-max-64gb",
   "chip": "M4 Max",
   "ramGb": 64,
   "bandwidthGBs": 546,
   "macs": "MacBook Pro 14/16, Mac Studio",
   "class": 64,
   "pack": "64"
  },
  {
   "id": "m4-max-128gb",
   "chip": "M4 Max",
   "ramGb": 128,
   "bandwidthGBs": 546,
   "macs": "MacBook Pro 14/16, Mac Studio",
   "class": 64,
   "pack": "64"
  },
  {
   "id": "m5-16gb",
   "chip": "M5",
   "ramGb": 16,
   "bandwidthGBs": 153,
   "macs": "MacBook Air, MacBook Pro 13/14, Mac mini, iMac",
   "class": 16,
   "pack": "16"
  },
  {
   "id": "m5-24gb",
   "chip": "M5",
   "ramGb": 24,
   "bandwidthGBs": 153,
   "macs": "MacBook Air, MacBook Pro 13/14, Mac mini, iMac",
   "class": 24,
   "pack": "24"
  },
  {
   "id": "m5-32gb",
   "chip": "M5",
   "ramGb": 32,
   "bandwidthGBs": 153,
   "macs": "MacBook Air, MacBook Pro 13/14, Mac mini, iMac",
   "class": 32,
   "pack": "32"
  },
  {
   "id": "m5-pro-24gb",
   "chip": "M5 Pro",
   "ramGb": 24,
   "bandwidthGBs": 307,
   "macs": "MacBook Pro 14/16, Mac mini",
   "class": 24,
   "pack": "24"
  },
  {
   "id": "m5-pro-48gb",
   "chip": "M5 Pro",
   "ramGb": 48,
   "bandwidthGBs": 307,
   "macs": "MacBook Pro 14/16, Mac mini",
   "class": 48,
   "pack": "48"
  },
  {
   "id": "m5-pro-64gb",
   "chip": "M5 Pro",
   "ramGb": 64,
   "bandwidthGBs": 307,
   "macs": "MacBook Pro 14/16, Mac mini",
   "class": 64,
   "pack": "64"
  },
  {
   "id": "m5-max-36gb",
   "chip": "M5 Max",
   "ramGb": 36,
   "bandwidthGBs": 614,
   "macs": "MacBook Pro 14/16, Mac Studio",
   "class": 32,
   "pack": "32"
  },
  {
   "id": "m5-max-48gb",
   "chip": "M5 Max",
   "ramGb": 48,
   "bandwidthGBs": 614,
   "macs": "MacBook Pro 14/16, Mac Studio",
   "class": 48,
   "pack": "48"
  },
  {
   "id": "m5-max-64gb",
   "chip": "M5 Max",
   "ramGb": 64,
   "bandwidthGBs": 614,
   "macs": "MacBook Pro 14/16, Mac Studio",
   "class": 64,
   "pack": "64"
  },
  {
   "id": "m5-max-128gb",
   "chip": "M5 Max",
   "ramGb": 128,
   "bandwidthGBs": 614,
   "macs": "MacBook Pro 14/16, Mac Studio",
   "class": 64,
   "pack": "64"
  }
 ],
 "classes": [
  {
   "class": 8,
   "pack": "8 GB · Lean",
   "label": "8 GB standard (M1/M2/M3 base)",
   "roles": {
    "router": "hf.co/mradermacher/Huihui-granite-4.1-3b-abliterated-i1-GGUF:i1-Q4_K_M",
    "writer": "hf.co/mradermacher/Huihui-granite-4.1-3b-abliterated-i1-GGUF:i1-Q4_K_M",
    "coder": "huihui_ai/qwen2.5-coder-abliterate:1.5b",
    "vision": "huihui_ai/qwen3.5-abliterated:2b",
    "reasoning": "hf.co/mradermacher/Huihui-granite-4.1-3b-abliterated-i1-GGUF:i1-Q4_K_M"
   },
   "maxResidentGb": 3.3,
   "context": 4096,
   "concurrent": 1,
   "voice": "off",
   "pictures": false,
   "downloadGb": 5.2,
   "basis": "measured: 8 GB simulation on an M5 Pro (4.8 GiB GPU budget, as the real M3 reports) + the 2026-10-09 real 8 GB M3 run; the real 8 GB M3 bench is pending",
   "status": "measured",
   "measuredOn": [
    "m5-pro-24gb-as-8gb.json",
    "vm/m5-pro-virtual-8gb.json"
   ]